<?xml version="1.0" encoding="UTF-8"?>
<xsd:schema
    xmlns:xsd="http://www.w3.org/2001/XMLSchema"
    xmlns:ccodelist="../commons/codelist"
    xmlns:cdichiara="../commons/dichiarazioni"
    xmlns:ctipi="../commons/tipi"
    xmlns:canncl="../commons/xsdAnnotations"
    xmlns:vpepergen="../01_vocabularies/persona_genere"
    xmlns:epepers="../02_entities/persona"
    targetNamespace="../02_entities/persona"
    elementFormDefault="qualified"
    attributeFormDefault="qualified"
    version="1.0.0"
    xml:lang="it">

    <xsd:import namespace="../commons/codelist" schemaLocation="../commons-codelist.xsd"/>
    <xsd:import namespace="../commons/dichiarazioni" schemaLocation="../commons-dichiarazioni.xsd"/>
    <xsd:import namespace="../commons/tipi" schemaLocation="../commons-tipi.xsd"/>
    <xsd:import namespace="../commons/xsdAnnotations" schemaLocation="../commons-xsd-annotations.xsd"/>
    <xsd:import namespace="../01_vocabularies/persona_genere" schemaLocation="../01_vocabularies/voc_pat_edilizia_persona_genere_v1.0.0.xsd"/>

    <xsd:complexType name="ent_pat_edilizia_persona_ctype">
        <xsd:sequence>
            <xsd:element name="nome" type="ctipi:stringa_standard_stype" minOccurs="1" maxOccurs="1"/>
            <xsd:element name="cognome" type="ctipi:stringa_standard_stype" minOccurs="1" maxOccurs="1"/>
            <xsd:element name="codiceFiscale" type="ctipi:codice_fiscale_stype" minOccurs="1" maxOccurs="1"/>
            <xsd:element name="sesso" type="vpepergen:sesso_voc" minOccurs="0" maxOccurs="1"/>
            <xsd:element name="dataNascita" type="ctipi:ggmmaaaa_stype"/>
            <xsd:element name="comuneNascita" type="ccodelist:CodeType" minOccurs="1" maxOccurs="1" >                
                <xsd:annotation>
                    <xsd:appinfo>                        
                        <canncl:codeListReference>
                            <canncl:ShortName>IT:SUAP:CL:ComuniItaliani</canncl:ShortName>
                        </canncl:codeListReference>                        
                    </xsd:appinfo>                    
                </xsd:annotation>                 
            </xsd:element>
            <xsd:element name="provinciaNascita" type="ccodelist:CodeType" minOccurs="1" maxOccurs="1" >                
                <xsd:annotation>
                    <xsd:appinfo>                        
                        <canncl:codeListReference>
                            <canncl:ShortName>IT:SUAP:CL:ProvinceItaliane</canncl:ShortName>
                        </canncl:codeListReference>                        
                    </xsd:appinfo>                    
                </xsd:annotation>                 
            </xsd:element>
            <xsd:element name="statoNascita" type="ccodelist:CodeType" minOccurs="0" maxOccurs="1">
                <xsd:annotation>
                    <xsd:appinfo>                        
                        <canncl:codeListReference>
                            <canncl:ShortName>IT:SUAP:CL:Stati</canncl:ShortName>                            
                        </canncl:codeListReference>                        
                    </xsd:appinfo>
                </xsd:annotation>                  
            </xsd:element>
        </xsd:sequence>
    </xsd:complexType>

    <xsd:element name="entita_pat_edilizia_persona" type="epepers:ent_pat_edilizia_persona_ctype"/>
</xsd:schema>
